Title,Body
Is Language Immersion a Good Idea?,"Share with a friend!

23 shares Share

Tweet

Pin

Email

Is it a good idea to put your child in a school where he doesn’t know the primary language spoken? In other words, is Language Immersion a good idea for early learners? How will this impact your child? Will they really learn the language well? Will they be able to adjust to the school environment or will it backfire?

I often hear parents saying that they chose to put their child in an Arabic School or a Spanish school because they wanted their child to learn the language from the start. They wanted their child to speak the language like the “native speakers”, they say. If they are immersed in the language, they will learn from the start. Is that a right thing to do?

What is Language Immersion

Language Immersion means to immerse yourself (or your child) in a environment where only one language (usually the one you don’t speak at all and want to learn) is spoken. The complete environment is focussed on learning that language.

Some of the ways in which you can immerse your child in learning a new language is to put them in a school where the medium of instruction is in that language. You can also choose to live in or travel to a country where that language is spoken and try to only be immersed in that culture.

The fastest way to teach your child to learn a new language (especially if you are a long time expat or migrant) is to put them in a school where they can have friends, teachers and the school environment focussed on that language only.

Is Language Immersion Schools a good idea for children?

As a mother of three multilingual children, I totally relate with the idea of Language Immersion. Putting your children in a public school where the language you want to focus on is the medium of instruction is a very good idea.

The children learn the language because that’s all that is spoken. It is sort of like a “swim or drown” kind of a scenario and mostly, because kids pick up language faster at a small age, they adapt quickly. But Language Immersion has it’s own pros and cons.

Our Experience with Language Immersion

We are a multilingual family. My husband and I speak six languages and my three children speak 4-5 each. That’s English, Arabic, Hindi, Urdu and French. I share my journey and tips to raising multilingual children here. You can also read further details in my interview here.

My husband and I – we both grew up here in Saudi Arabia. Although, I have lived here all my life, I still don’t consider myself a fluent Arabic speaker. I have a lot of Arabic speaking friends (who speak english with me!) and I know a lot of Saudi Culture but… we are not an Arabic speaking family.

My children speak 4-5 languages each. My children have been in a Arabic Medium School as well as Private and International Schools. We have also homeschooled two kids for three years during the pandemic.

I started my eldest (son) in an Arabic medium school in Kindergarten and for two years, he was in complete Arabic environment. We later shifted him to an International (Multicultural – Multilingual) School where Arabic speaking students and teachers were in majority. He studied in that environment for 9 years.

My daughters started at the International (Multicultural – Multilingual) School but we later shifted to homeschooling and then a Community School.

It’s important to have an education goal for your children

Our goal with our children’s education is that they should be fluent in Arabic first. We don’t want them facing the same problems we are facing – the language barrier. Also, Arabic is the language of the Quran. Of course, Quranic Arabic and Modern Arabic is different but it is still Arabic. You can understand what you’re reading in the Quran quite well if you understand any Arabic.

I also wanted that my children to grow up in a multicultural environment. It is important to me that they accept diversity of language, culture, religion and looks naturally growing up. And I wanted my children to be surrounded with all types of people and be able to make friends and converse with everyone.

And then, like every mother, I wanted to give my children world-class education. I want them to develop the skills that is needed to thrive in the modern future tomorrow. Skills like communication, responsible technology use, curiosity, inquisitiveness as well as leadership skills and the ability to work together with others is very important to me as is appreciation of art and culture.

How to find a good school for Language Immersion

We started our school hunting for the children years ago, and the best thing that we did was to go around schools speaking to them and looking around.

We knew that we had to be clear about what we wanted in the school. But we were also looking for an environment that would help the child comfortably learn and grow without it feeling like we were forcing the language and culture upon him.

There were two things that I did that really helped me in finding a good school for my children:

Visiting the school, looking at their curriculum and books, and talking to the teachers and staff. Asking for reviews from parents who already had kids at that school.

Now, this was years ago and we didn’t have WhatsApp Groups then, so I had to rely on word of mouth and meet up with parents and specifically ask them.

For Language Immersion, many parents feel that the school should only teach one language and nothing else for it to be successful. My experience has been that it is good idea if the teachers and students can speak a common language with you too. For example, if there are few kids and teachers who can converse in English a little bit, it will be a very helpful for both you and your child to learn in the environment.

My children thrived more at an International school which had focus on Arabic and Islamic Studies. They had three subjects in Arabic. The teachers in the Arabic classes spoke only in Arabic. The children were Arabic speaking majority too.

For information on schools in Jeddah, Saudi Arabia, please see this post.

What to look for in a school for teaching a language?

In my opinion, whether you are a migrant, expat or just a multilingual family looking to immerse your child in a language, you will still want your child to excel at other subjects and possibly, in the future have his options open to study anywhere around the world. So putting your child in a school where they don’t teach any amount of English or where English is just a language subject may be a bad idea.

And parents who want to make the switch to an English school after 4-5 years: no, even in 4-5 years your kids won’t be as fluent in Arabic as a native because of external factors such as your home language and any exposure to additional languages. Also, moving them from a completely Arabic to a completely English environment might be detrimental too. They will be average at everything. And it will be a struggle to get them to adopt a new medium of instruction from the beginning.

Let me give you an example: When they have been accustomed to Science and Math in Arabic, learning all the terms in English and rewiring their brain to new words and information while they are trying to be the same level as their peers is not going to be easy.

Challenges parents and children face at Language Immersion school

I am not a native Arabic speaker. In fact, I think I got a chance to immerse myself in the language more than my kids.

Supporting your child

One of the biggest challenges parents face is that if you don’t speak that language, you will have trouble teaching your child. Irrespective of how good your school is, we parents always need to support our children’s learning at home.

Now, it is going to be a learning opportunity for you too but there may be times when you will have trouble yourself. Like when they are talking about the Solar System, weather cycles and mathematical concepts in their language or asking you to give your thoughts about a matter! ::Ouch::

Of course you can Google Translate and surround yourself with people who can help you in translating, but many times you will be challenged. (Especially at the end of the day, when it’s past bedtime and you forgot to see that circular or your child comes to you with homework!)

Smarter or Dumb?

Also, if your school doesn’t have other multicultural children, your child may end up being the “Unicorn”. They will be the odd one out.

They may be a different culture from the other students and also, probably more or less mature than the other children their age. So the teachers are going to tell you that your kid is “unique”, “smarter”, “oh-so-intelligent” or they will call your child “slow”, “learning challenged”, “not cooperative”, “shy and quiet”. And it can be a problem in two directions. We had this problem.

When my son was in KG2 although he was the same age as other children, I found that at school, they were quite behind curriculum-wise. My son wasn’t learning much. He was just going there to while away time, chitchat with the teachers and “become their pet”.

Okay, so may be, he was smarter for his age. May be, quite possibly, he was a fast learner and the school environment wasn’t challenging enough. So we changed schools and put him in a Private International School where the majority of the students were locals and they focussed on Arabic and Islamic education.

It was a school with fusion curriculums – IGCSE, American and Saudi Board. The medium of instruction was English and they had three subjects in Arabic – Arabic, Social Studies in Arabic and Islamic Studies in Arabic. Math, Science and other subjects were all Pearson Books and they also had a third language — French.

Our experience with a private International school was much better than with the private Arabic school. My son could make friends, speak to them in both English and Arabic and still learn the language both formally and naturally.

Local Dialect

The trouble with immersing your child in a language is that they will learn the local dialect faster than the formal language. It is natural for them to learn this way because they will be conversing with their friends in the local dialect more.

Also, depending on the students who study at that school, it is quite possible they will learn a totally different dialect than that you intended. My son, for example was learning the Levantine Arabic more than the Saudi one in the Arabic School. In the International School, it was Saudi dialect.

Friends and Bullies

Then there is the question of friendships. Kindergarten children like to play side by side more than WITH the other children. So you may not find that much of a problem with them making friends. But in primary class children, where friendships are more important and children’s confidence is built around trying to fit in, you will find that your child’s inability to converse or his being a different culture may or may not be hinder his ability to make friends.

So, bullying, mean-girls, football-politics, silent treatments, etc happen more in primary and upper grades. But that can happen in any school irrespective of whether you immerse or not. (That’s my experience.)

So, there are definite benefits to Language Immersion.

Do children in Language Immersion learn the language really fast?

Yes. My son is 16 years old now. He speaks fluent Arabic, can understand and translate the Quran while it is being read and he converses in the language like the native.

My two daughters started in the same multicultural International school from the beginning. I didn’t put them in Language Immersion from the beginning because I was happy with the Multicultural school environment my son was at.

But during the pandemic I pulled them out from the International school for Open Schooling/ Homeschooling and we didn’t send them back to the Arab International school. They speak Arabic and understand the Quran well too, but not as well as my son.

My daughters spent 2-3 years in Kindergarten and then 2-3 years in primary school, learning with Arab teachers and being around Arabic speaking friends,. They did pick up the language, accent and reading skills. But they weren’t as fast as my son who had spent the first two years of his schooling in a totally Arabic environment.

The girls had Arab friends and they spoke in Arabic with them too. My son however spent 10 years in that environment while my girls spent only 5 years. So, may be if they had spent some more time, they’d have become more fluent. I don’t know…

What my experience with Language Immersion taught me

I absolutely support the idea of Language Immersion. I have talked about all the pros and cons so far above in this post but there are certain things that nobody talks about that I want to share with you.

Culture

When you put your child in a school and language that is very different from your own culture and language, be ready to accept that your children will learn more of the other culture than your own. Now, that can be a good thing or a bad thing.

When you put your children in Language Immersion and choose to send your children in a school where the culture and language are both not their native, kids have an identity crisis. They will begin to sound like their friends quite fast but then they will to want to look and sound like “them” too. They will enjoy dressing like them, using the words they use, their body language will be like them… in short, you will be raising a Fusion Kid.

We parents will have to strive harder to teach our kids our manners, religious and cultural ways. Of course, whether you choose to raise your child in your country or in another, and whether you choose to educate them in a different language or English, this problem will still be there – more or less – but in my experience, language immersion will have more impact on your child’s identity.

In a way, it’s a parenting challenge… so you need to understand that going in. Be ready to accept that your child will be different from you.

Thinking

It is not just how they look and behave but their thinking will be impacted too.

They will understand their school’s culture better than yours.

They will relate with their friends and the host country more than their own.

They will speak strongly on issues that are being talked about in their circles and often it will be issues you don’t care or relate with.

This may be a generation thing… and I am sure our parents may have felt this way raising us too but it is something that I have had a chance to notice because I have raised kids in two different types of school environment.

When my kids were at the Arabic School, they had an Arabic accent to their English and Urdu (our mother tongue) and it was all fancy-shmancy Arabic Netfilx drama. (If you know you know ).

But now that they are at a community school, where they have friends who are like them, they understand our family and country’s cultures better. I don’t have to explain things as much as before because they probably already learnt that at their school.

Manners, behavior, etiquettes, family values… come easier to children who have people like them around them.

Friendships

I didn’t think that my kids had trouble finding good friends at their previous schools. In fact, they didn’t know it either until they moved to a community school and saw how easier it was to talk to people who looked, talked and behaved like themselves.

They felt closer to their teachers who reminded them of their parents, aunts or grandparents. Their manners and body language was easier to understand. Do you know what I mean..?

Conclusion:

Language Immersion is one of the best ways for anyone to learn a new language fast, but for kids, we parents need to think about a lot more than just language.

We have to remember that when we choose to put our child in a school for the first time, it is going to be the foundation you are setting, upon which they will experience a relationship to life long learning.

I hope this article helps you in choosing the right school for your child and in starting your child’s journey to loving a language. Do leave a comment and tell me your thoughts.

Hey, want to stay in touch? Subscribe to the Jeddah Mom Tribe! We send a weekly email with all the updates from our site and more! Almost done! Now check your email to confirm your subscription. Don't forget to whitelist all my emails! Check if my email has arrived in the Primary folder. If not drag it there so you can continue getting future mails. It's good to have you. Talk Soon, Aysh

Share with a friend!

23 shares Share

Tweet

Pin

Email"
Arabic Language Blog,"In this post, we’ll practice using numbers الأرقام and words related to numbers in Arabic through answering some fun questions about our daily lives حياتنا اليومية. Before we begin, let’s look at the following vocabulary words that will help us understand the questions and help us answer them. مدة/ فترة: a period of time تقضي/تمضي…

Continue Reading"
Why should you learn Arabic?,"Why should you learn Arabic?

by Mahmoud Hassan

Maybe you are not sure if learning Arabic is really for you. The following 10 points may help you get a clearer idea

1. Are Your Activities Related to Islam?

The Kaaba in Makkah, Saudi Arabia, is the center point of the Muslim world. Arabic is the language of worship in Islam. The Arabic language plays a central role in Islam. It is the language of the Quran, and the source language of Islamic jurisprudence and religious literature.

The Quran in Arabic is the only version accepted as being ""the Quran"". The meanings of the Quran can be translated to other languages, but these are only regarded as ""translations of the meaning of the Quran"".

Arabic is the language of worship - prayers are read in Arabic, and the international greeting between Muslims is in Arabic. Non-Arab Muslims are encouraged to learn Arabic to enable them to read the Quran and improve their understanding of it.

Knowledge of Arabic is the best tool for both Muslims and Non-Muslims to understand what Islam is about. It also helps in building positive interaction with Muslim communities.

2. Are You Doing Business with the Arab World?

The Arab countries are in the process of reforming and diversifying their economies. Business regulation is improved in order to make the economies more competitive and to attract entrepreneurs. In the Arabian Gulf, for example, huge investments are made in areas like construction, finance, telecom and tourism.

The size of the Middle Eastern economy as a whole has increased by approximately 120% in the five-year period from mid-2003 to mid-2008. As a result of the ""Arab Spring"", which is changing the patterns of governance in many parts of the Arab world, business and investment opportunities are likely to increase at a fast rate.

Knowledge of Arabic provides better insight into all aspects of business in the Arab World. The business culture in the Arab World is very much about building personal relationships of mutual trust. In this environment, knowledge of Arabic can be instrumental in fostering deeper business relations.

3. Are You into Diplomatic or Cultural Relations?

Knowledge of Arabic is instrumental in building positive relationships of exchange with the Arab world. The Arab world is moving towards a new era, characterized by more openness and liberalization.

There is a tendency towards reforms aiming at more government transparency and increased public participation in decision-making this development benefits trade relations and cultural exchange between the Arab countries and the rest of the World. Knowledge of Arabic is an essential for anyone seeking profound understanding of the culture and thinking-patterns of the Arab world.

4. Do You Often Travel to The Arab World?

Welcome to the souq, the traditional market, where there is no shortage of merchandise! Arabs feel honored when foreigners make an attempt to speak their language. Even a few phrases make a difference. Having sound knowledge of the language makes you an extra welcome and honored guest. Knowledge of Arabic gives you the opportunity to get closer to the locals and get better insight into their culture and traditions... and wouldn't it be nice if you were able to read and understand all written signs...?

5. Do You Live as an Expat in an Arab Country?

Living in a country without being able to understand its language, can be frustrating. It makes you feel like a stranger, regardless of how long you stay. If you are an expatriate in an Arab country, you have probably realized how much easier, and also enjoyable, your daily life would be if you knew how to read and speak Arabic.

6. Are You Planning for a Job in an Arab Country?

With the Arab economies set on steady growth, professionals in various fields are in high demand. Knowledge of Arabic can increase your chances of getting an interesting and rewarding job in an Arab country.

Examples of professions where knowledge of Arabic is desirable: Foreign Correspondent, Translator, Technical Engineer, Geologist, Banker, International Consultant, Foreign Service Officer, International Lawyer, Teacher, Researcher, Doctor, Nurse, Dentist, and Social Worker.

7. Do You Have an Interest in Arab Culture and Affairs?

""What would you like to drink?"" A common question, and gesture of hospitality, in the Arab world. Getting to the roots of Arab culture is best done through its most cherished treasure - the Arabic language. The traditional hospitality of the Arabs, which visitors to the Arab world often have the pleasure to witness, becomes even more cordial when the guest shows an ambition to communicate in Arabic. The guest is not expected to speak perfect Arabic, and it is the good intention that counts. Even a few words are appreciated. Whether your contacts are social or business, knowledge of Arabic is likely to boost your status, and help foster trust and solid relationships.

8. Do You Have Arab Family Members?

Maybe you have relatives or friends from an Arab country. Learning to communicate with Arab family members or friends in their own language can be both interesting and fun. It can add a whole new dimension to your life. It would enable you to better understand their emotions and thinking patterns. And you would surely benefit personally from the positive impact this would have on yourself.

9. Does Your Work Involve Contacts with Arab Immigrant Communities?

If your type of work includes contact with Arab immigrants, knowledge of Arabic can facilitate your work and improve relations between yourself and your clients.

10. Do You Enjoy the Challenge of Learning New Languages?

Maybe you are keen to learn a new language, but you want to try something different... something more exotic... a more ""unusual"" type of language...Some simply start learning Arabic ""for the heck of it""... Learning Arabic can be challenging, but the reward is great, once you begin to appreciate the unique beauty and richness of this great language.

Convinced that learning Arabic is worth trying? Begin your studies the easy way right here.

About the writer

This article was brought to you by Mahmoud Hassan of the Alustadh Insitute for Arabic and Islamic Studies

Information about Arabic | Phrases | Numbers | Tower of Babel | Articles | Links | Arabic courses on: Amazon.com and Amazon.co.uk [affilate links]

Writing systems | Language and languages | Language learning | Pronunciation | Learning vocabulary | Language acquisition | Motivation and reasons to learn languages | Arabic | Basque | Celtic languages | Chinese | English | Esperanto | French | German | Greek | Hebrew | Indonesian | Italian | Japanese | Korean | Latin | Portuguese | Russian | Sign Languages | Spanish | Swedish | Other languages | Minority and endangered languages | Constructed languages (conlangs) | Reviews of language courses and books | Language learning apps | Teaching languages | Languages and careers | Being and becoming bilingual | Language and culture | Language development and disorders | Translation and interpreting | Multilingual websites, databases and coding | History | Travel | Food | Other topics | Spoof articles | How to submit an article

[top]

You can support this site by Buying Me A Coffee, and if you like what you see on this page, you can use the buttons below to share it with people you know.

If you like this site and find it useful, you can support it by making a donation via PayPal or Patreon, or by contributing in other ways. Omniglot is how I make my living.

Note: all links on this site to Amazon.com , Amazon.co.uk and Amazon.fr are affiliate links. This means I earn a commission if you click on any of them and buy something. So by clicking on these links you can help to support this site.

[top]"
