Title,Body
Saudi Translation Forum: Language plays ‘crucial role’ in shaping society,"The First Saudi Translation Forum was held in Riyadh on 2-3 December 2021. This forum brought local and international language translation experts under one roof and was considered the largest translation gathering hosted in Saudi Arabia.

Organized by the Literature, Publishing and Translation Commission, and took place at the headquarters of the Saudi Ministry of Education, this two-day translation forum aimed to address the main challenges that the global translation industry is currently facing.

In his opening speech, Dr. Mohammed Hasan Alwan, CEO of the commission, highlighted the importance of translation and the country’s support towards this industry: “Saudi Arabia has one of the biggest translation and publishing markets in the region, and we are exerting all efforts to grow the sector even more through nurturing and encouraging local writers and translators, forging international collaborations, and developing a supportive regulatory framework.”

Prof. Brian James Baer, President of the American Translation and Interpretation Association, and a guest speaker in the forum recognized the key issues of the global translation sector: “stagnant income for translators, and a lack of understanding of what translation is.” He emphasized that “language is asymmetrical”, and translators “need to manage this asymmetry” with creativity. He also pointed out the current limitations of machine translation when it comes to literature, and the need to use the technology wisely.

In addition, the forum engaged the audience with various interactive workshops, panel discussions, and the Kingdom’s first audiovisual translation challenge for students, beginners, and translation professionals. To conclude the event, winners of the “Motivation Challenge” took home generous prizes ranging from SR5,500 ($1,466) to SR20,000 ($5,330). The task was to translate short film clips about Saudi culture and history from Arabic into English, French, Spanish, and Korean.

To read more, please see: https://www.arabnews.com/node/1980841/saudi-arabia"
Our Blog - Latest News and Information,"E-commerce Ecommerce website translation is booming and with the demand for online shopping experiences growing year on year, thousands of businesses are going digital. Once you’re selling online, the quickest way to increase your customer share and reach? Localization. Know More

Hospitality & Leisure The hospitality industry demands localized content to communicate with customers from all over the world. Whether you work in travel, accommodation, recreation, tourism or food and beverage, our translators and content creators are experienced and ready to support you. Know More

Media & Entertainment We live in a world of instant news, media and entertainment, so when your brand needs to communicate important updates, information and marketing content, you need to meet your audience in their language. Are you ready to raise your profile? Know More



Digital Technology User experience is one of the most important areas of app development, and with almost half the global population using smartphones, it’s your job to make sure your content is ready to serve the technologically-savvy Arabic speaking market. Know More

Business & Finance Accuracy, in-depth knowledge and attention to detail are essential features of corporate translation. Our specialist translators focus on terminology, tone and format to ensure your business contracts, finance documents and corporate communication are equally represented in English and Arabic. Know More"
British Council Saudi Arabia,"Many learners of English tell me “I can understand almost anything - I just can’t speak!” It’s a common phenomenon in learning any language, and teachers or fluent speakers will tell you, as

Tags Learn English, Learn English adults, Speaking, Spoken English, An adult (18+ years)"
Best 5 Institutes to Learn Spanish in Riyadh,"Do you want to learn Spanish in Riyadh? Are you thinking of enrolling in the Spanish language learning courses in Saudi Arabia? Then, you have come to the right place. Saudi Arabia is the hub of the top multinational companies that require Spanish language speakers to communicate with Spanish clients. Apart from this, learning Spanish allows you to explore a wide range of literature, music, and art from Spanish-speaking countries.

With more than 500 million speakers worldwide, Spanish is one of the most commonly spoken languages in the world. Additionally, it is the official language of more than 20 nations with significant creative and cultural histories, such as Spain, Mexico, Colombia, Argentina, and Chile.

Moreover, there are multiple benefits of learning Spanish in Riyadh for adults. Learning Spanish allows you to widen your cultural horizons and get a greater respect for Spanish-speaking cultures, ranging from the vivid energy of Mexican telenovelas to the beautiful writing of Gabriel Garcia Marquez’s books.

Learning Spanish may, in essence, open doors to a world of literature, art, and culture that would otherwise be unreachable.

In this blog, we will provide you with a list of the top 5 Spanish language learning courses in Saudi Arabia. These institutes provide the best Spanish language learning courses in Saudi Arabia.

Top 5 Institutes to Learn Spanish in Riyadh

Kochiva Hispania Academy The Knowledge Academy Henry Harvin EF (Education First)

Kochiva (Best For Online Spanish Classes)

Kochiva is an online platform offering top-notch Spanish language learning courses in Saudi Arabia. Our comprehensive curriculum is designed to help learners master the Spanish language while gaining a deeper understanding of its rich culture. With a focus on effective communication, our online Spanish classes in Riyadh cover all key aspects of language learning, including vocabulary, grammar, reading, writing, and speaking skills.

Our small, interactive batch sizes and flexible scheduling options make us stand out. Our expert trainers, certified at C1/C2 levels, help learners to learn Spanish in Riyadh.

We ensure personalized attention for every learner. Kochiva provides Spanish language training courses in Riyadh for adults, kids, and even corporate professionals, tailoring the courses to suit different learning needs.

Our Spanish courses in Riyadh are aligned with the Common European Framework of Reference (CEFR), preparing students for globally recognized Spanish proficiency tests such as DELE and SIELE. Whether you’re learning Spanish for personal growth, academic advancement, or professional purposes, Kochiva has the right course for you.

Hispania Academy

Hispania Academy offers exceptional Spanish language education for students of all ages to learn Spanish in Riyadh. Their team of expert trainers brings the joy of learning Spanish to kids, teenagers, and adults through their comprehensive and engaging extra-curricular program (ECP) conducted after school hours.

Their Spanish courses in Riyadh cater to all levels of proficiency, from beginners’ A1 level of Spanish to advanced levels. In addition to group classes of learn Spanish in Riyadh, they also offer private one-on-one Spanish language lessons, providing a personalized learning experience tailored to individual needs and goals.

Apart from this, they understand the demands of the school timings. That’s why they offer Spanish classes for kids in Riyadh after school hours. In this way, they provide an appropriate opportunity for students to explore the richness of the Spanish language without conflicting with their academic commitments.

The Knowledge Academy

The Knowledge Academy provides different Spanish language courses that help learners to learn Spanish in Riyadh. They have an intensive course with a preset curriculum based on CEFR.

Moreover, the emphasis is on laying a strong grammatical foundation. They design their Spanish lessons in Riyadh curriculum at international levels established by CEFR. The multi-media tools enhance the learning experience through audio and visual aids.

Moreover, their learn Spanish in Riyadh courses are fully intensive and ensure that students get the proper information in the minimum period.

They believe that the first three levels, i.e., A1, A2, and B1 level of Spanish, are the building blocks of the language and provide students with a solid foundation to progress from one level to the next.

They also have special Spanish courses for children of age 6 to 12. Every session has fun activities that are full of thrill and excitement to help students learn Spanish easily.

Henry Harvin

Henry Harvin is a well-known institute that provides Spanish language learning courses in Saudi Arabia. They provide career counseling to students so that they can make informed decisions. The main goal is to give young learners Spanish classes that are focused on finding work.

Their primary goal is to instill in the students a passion for the Spanish language and culture. Also, you can enhance your proficiency in the Spanish language by focusing on grammatical errors with their courses.

You also get the chance to learn Spanish from the native speakers. Apart from this, the institute provides 100% guaranteed placements to all learners. Moreover, you get 1-year gold membership of Henry Harvin’s language academy. Along with that, you get 10+ weekly job opportunities.

EF (Education First)

EF’s experiential learning Spanish language training course in Riyadh focused on language, travel, cultural exchange, and academics. Their Spanish classes in Saudi Arabia help to turn dreams into opportunities for people of all ages and nationalities.

Whether you’re a student who’s interested in studying Spanish and gaining international experience or a professional looking to learn Spanish for business or trade, their Spanish class programs will improve your skills and broaden your worldview.

By utilizing both classroom and experiential learning techniques, you can truly connect to the Spanish language and culture.

Spend a day studying in their intensive Spanish language school in Riyadh, and then step outside and practice your new Spanish skills with the natives.

Conclusion ( Learn Spanish in Riyadh )

In summary, learning Spanish in Riyadh is not just a linguistic skill but a gateway to personal, professional, and cultural growth.

Moreover, with more people speaking Spanish around the world, it’s a good time to enroll in Spanish language learning courses in Saudi Arabia.

The institutes we’ve mentioned in this blog all have different teaching methods, experienced tutors, and fun ways of learning to further help learners learn Spanish in a natural and easy way."
